### ISSUE TITLE
SNOW-691474: Connector retries 12 times - Application hangs for 12 minutes before failing

### ISSUE THREAD

**Issue by sfc-gh-nsemmler** [snowflakedb/snowflake-connector-python#1325]
Let's say you want to login at a server, but you are in the wrong network. You have configured the `login_timeout` to 60 seconds. How long would you expect to wait before the call to connect fails?

No, it's not 60 seconds it is more than 12 minutes. 

Why?
- The connector attempts to authenticate twice.
- The connector attempts to create the connection connection twice.
- urllib3 attempts the connection 3 times. 

1. What version of Python are you using?

Python 3.8.15 (default, Oct 27 2022, 17:03:06)
[GCC 4.8.5 20150623 (Red Hat 4.8.5-44)]

2. What operating system and processor architecture are you using?

Linux-5.16.13-generic-aarch64-with-glibc2.17

3. What are the component versions in the environment (`pip freeze`)?

```
anyio==3.5.0
argon2-cffi==21.3.0
argon2-cffi-bindings==21.2.0
asn1crypto==1.5.1
asttokens==2.0.5
attrs==21.4.0
Babel==2.9.1
iniconfig==1.1.1
ipdb==0.13.9
ipykernel==6.9.2
ipython==8.1.1
ipython-genutils==0.2.0
ipywidgets==7.7.0
isort==5.10.1
jedi==0.18.1
Jinja2==3.1.0
json5==0.9.6
jsonschema==4.4.0
jupyter==1.0.0
jupyter-client==7.1.2
jupyter-console==6.4.3
jupyter-core==4.9.2
jupyter-server==1.15.6
jupyterlab==3.3.2
jupyterlab-pygments==0.1.2
jupyterlab-server==2.11.2
jupyterlab-widgets==1.1.0
jupytext==1.13.7
keyring==23.5.0
kiwisolver==1.4.4
markdown-it-py==1.1.0
MarkupSafe==2.1.1
matplotlib==3.6.2
matplotlib-inline==0.1.3
mdit-py-plugins==0.3.0
mistune==0.8.4
nbclassic==0.3.7
nbclient==0.5.13
nbconvert==6.4.4
nbformat==5.2.0
nest-asyncio==1.5.4
notebook==6.4.10
notebook-shim==0.1.0
numpy==1.23.4
oscrypto==1.3.0
packaging==21.3
pandas==1.3.5
pandocfilters==1.5.0
parso==0.8.3
patsy==0.5.2
pexpect==4.8.0
pickleshare==0.7.5
Pillow==9.3.0
pipenv==2022.10.25
pkgutil_resolve_name==1.3.10
platformdirs==2.5.2
plotly==5.6.0
pluggy==1.0.0
prometheus-client==0.13.1
prompt-toolkit==3.0.28
psutil==5.9.0
ptyprocess==0.7.0
pure-eval==0.2.2
py==1.11.0
pyarrow==8.0.0
pycparser==2.21
pycryptodomex==3.15.0
Pygments==2.11.2
PyJWT==2.6.0
pyOpenSSL==22.0.0
pyparsing==3.0.7
pyrsistent==0.18.1
pytest==7.1.1
python-dateutil==2.8.2
pytz==2022.5
PyYAML==6.0
pyzmq==22.3.0
qtconsole==5.2.2
QtPy==2.0.1
requests==2.28.1
scipy==1.8.0
Send2Trash==1.8.0
six==1.16.0
sniffio==1.2.0
snowflake-connector-python==2.8.0
snowflake-snowpark-python==0.12.0
snowflake-sqlalchemy==1.3.3
soupsieve==2.3.1
SQLAlchemy==1.4.32
stack-data==0.2.0
statsmodels==0.13.2
tenacity==8.0.1
termcolor==1.1.0
terminado==0.13.3
testpath==0.6.0
tinycss2==1.2.1
toml==0.10.2
tomli==2.0.1
tornado==6.1
traitlets==5.1.1
typing_extensions==4.4.0
urllib3==1.26.12
virtualenv==20.16.6
virtualenv-clone==0.5.7
visidata==2.10.2
wcwidth==0.2.5
webencodings==0.5.1
websocket-client==1.3.1
widgetsnbextension==3.6.0
wquantiles==0.6
yapf==0.32.0
zipp==3.7.0
```

4. What did you do?

```
import snowflake.connector as snow
snow.connect(**{
    'account': 'myaccount',
    'user': 'myuser',
    'password': 'mypassword',
    'port': 8084,
    'host': "fubar.snowflakecomputing.com",
    "login_timeout": 5
})
```

5. What did you expect to see?

Connection fails after 5 seconds due to missing timeout.

6. What did you see?

Connection failed after 62 seconds. 

Explanation: 12 retries across the implementatino

7. Can you set logging to DEBUG and collect the logs?

```
2022-11-09 11:46:57,258 - MainThread connection.py:274 - __init__() - INFO - Snowflake Connector for Python Version: 2.8.0, Python Version: 3.8.15, Platform: Linux-5.16.13-generic-aarch64-with-glibc2.17
2022-11-09 11:46:57,259 - MainThread connection.py:519 - connect() - DEBUG - connect
2022-11-09 11:46:57,259 - MainThread connection.py:809 - __config() - DEBUG - __config
2022-11-09 11:46:57,259 - MainThread connection.py:933 - __config() - INFO - This connection is in OCSP Fail Open Mode. TLS Certificates would be checked for validity and revocation status. Any other Certificate Revocation related exceptions or OCSP Responder failures would be disregarded in favor of connectivity.
2022-11-09 11:46:57,259 - MainThread converter.py:145 - __init__() - DEBUG - use_numpy: False
2022-11-09 11:46:57,259 - MainThread connection.py:712 - __open_connection() - DEBUG - REST API object was created: fubar.snowflakecomputing.com:80842022-11-09 11:46:57,259 - MainThread auth.py:170 - authenticate() - DEBUG - authenticate
2022-11-09 11:46:57,260 - MainThread auth.py:200 - authenticate() - DEBUG - assertion content: *********
2022-11-09 11:46:57,260 - MainThread auth.py:203 - authenticate() - DEBUG - account=myaccount, user=user, database=None, schema=None, warehouse=None, role=None, request_id=632a685c-8715-43a9-afed-a807df3cb26b
2022-11-09 11:46:57,260 - MainThread auth.py:236 - authenticate() - DEBUG - body['data']: {'CLIENT_APP_ID': 'PythonConnector', 'CLIENT_APP_VERSION': '2.8.0', 'SVN_REVISION': None, 'ACCOUNT_NAME': 'myaccount', 'LOGIN_NAME': 'user', 'CLIENT_ENVIRONMENT': {'APPLICATION': 'PythonConnector', 'OS': 'Linux', 'OS_VERSION': 'Linux-5.16.13-generic-aarch64-with-glibc2.17', 'PYTHON_VERSION': '3.8.15', 'PYTHON_RUNTIME': 'CPython', 'PYTHON_COMPILER': 'GCC 4.8.5 20150623 (Red Hat 4.8.5-44)', 'OCSP_MODE': 'FAIL_OPEN', 'TRACING': 10, 'LOGIN_TIMEOUT': 5, 'NETWORK_TIMEOUT': None}, 'SESSION_PARAMETERS': {'CLIENT_PREFETCH_THREADS': 4}}
2022-11-09 11:46:57,260 - MainThread auth.py:254 - authenticate() - DEBUG - Timeout set to 5
2022-11-09 11:46:57,261 - MainThread retry.py:351 - from_int() - DEBUG - Converted retries value: 1 -> Retry(total=1, connect=None, read=None, redirect=None, status=None)
2022-11-09 11:46:57,261 - MainThread retry.py:351 - from_int() - DEBUG - Converted retries value: 1 -> Retry(total=1, connect=None, read=None, redirect=None, status=None)
2022-11-09 11:46:57,261 - MainThread network.py:1147 - _use_requests_session() - DEBUG - Session status for SessionPool 'fubar.snowflakecomputing.com', SessionPool 1/1 active sessions
2022-11-09 11:46:57,261 - MainThread network.py:827 - _request_exec_wrapper() - DEBUG - remaining request timeout: 5, retry cnt: 1
2022-11-09 11:46:57,261 - MainThread network.py:808 - add_request_guid() - DEBUG - Request guid: aab79e81-8230-4549-837e-ce902d39e010
2022-11-09 11:46:57,261 - MainThread network.py:1006 - _request_exec() - DEBUG - socket timeout: 5
2022-11-09 11:46:57,263 - MainThread connectionpool.py:228 - _new_conn() - DEBUG - Starting new HTTP connection (1): fubar.snowflakecomputing.com:8084
2022-11-09 11:47:12,302 - MainThread retry.py:594 - increment() - DEBUG - Incremented Retry for (url='/session/v1/login-request?request_id=632a685c-8715-43a9-afed-a807df3cb26b&request_guid=aab79e81-8230-4549-837e-ce902d39e010'): Retry(total=0, connect=None, read=None, redirect=None, status=None)
2022-11-09 11:47:12,302 - MainThread connectionpool.py:812 - urlopen() - WARNING - Retrying (Retry(total=0, connect=None, read=None, redirect=None, status=None)) after connection broken by 'ConnectTimeoutError(<snowflake.connector.vendored.urllib3.connection.HTTPConnection object at 0xffff8cedb0a0>, 'Connection to fubar.snowflakecomputing.com timed out. (connect timeout=5)')': /session/v1/login-request?request_id=632a685c-8715-43a9-afed-a807df3cb26b&request_guid=aab79e81-8230-4549-837e-ce902d39e010
2022-11-09 11:47:12,303 - MainThread connectionpool.py:228 - _new_conn() - DEBUG - Starting new HTTP connection (2): fubar.snowflakecomputing.com:8084
2022-11-09 11:47:27,354 - MainThread network.py:1090 - _request_exec() - DEBUG - Hit a timeout error while logging in. Will be handled by authenticator. Ignore the following. Error stack: HTTPConnectionPool(host='fubar.snowflakecomputing.com', port=8084): Max retries exceeded with url: /session/v1/login-request?request_id=632a685c-8715-43a9-afed-a807df3cb26b&request_guid=aab79e81-8230-4549-837e-ce902d39e010 (Caused by ConnectTimeoutError(<snowflake.connector.vendored.urllib3.connection.HTTPConnection object at 0xffff8cedb940>, 'Connection to fubar.snowflakecomputing.com timed out. (connect timeout=5)'))
Traceback (most recent call last):
  File "/media/psf/Home/vm_files/notebooks/venv/lib/python3.8/site-packages/snowflake/connector/vendored/urllib3/connection.py", line 174, in _new_conn
    conn = connection.create_connection(
  File "/media/psf/Home/vm_files/notebooks/venv/lib/python3.8/site-packages/snowflake/connector/vendored/urllib3/util/connection.py", line 95, in create_connection
    raise err
  File "/media/psf/Home/vm_files/notebooks/venv/lib/python3.8/site-packages/snowflake/connector/vendored/urllib3/util/connection.py", line 85, in create_connection
    sock.connect(sa)
socket.timeout: timed out

During handling of the above exception, another exception occurred:

Traceback (most recent call last):
  File "/media/psf/Home/vm_files/notebooks/venv/lib/python3.8/site-packages/snowflake/connector/vendored/urllib3/connectionpool.py", line 703, in urlopen
    httplib_response = self._make_request(
  File "/media/psf/Home/vm_files/notebooks/venv/lib/python3.8/site-packages/snowflake/connector/vendored/urllib3/connectionpool.py", line 398, in _make_request
    conn.request(method, url, **httplib_request_kw)
  File "/media/psf/Home/vm_files/notebooks/venv/lib/python3.8/site-packages/snowflake/connector/vendored/urllib3/connection.py", line 239, in request
    super(HTTPConnection, self).request(method, url, body=body, headers=headers)
  File "/home/nsemmler/.pyenv/versions/3.8.15/lib/python3.8/http/client.py", line 1256, in request
    self._send_request(method, url, body, headers, encode_chunked)
  File "/home/nsemmler/.pyenv/versions/3.8.15/lib/python3.8/http/client.py", line 1302, in _send_request
    self.endheaders(body, encode_chunked=encode_chunked)
  File "/home/nsemmler/.pyenv/versions/3.8.15/lib/python3.8/http/client.py", line 1251, in endheaders
    self._send_output(message_body, encode_chunked=encode_chunked)
  File "/home/nsemmler/.pyenv/versions/3.8.15/lib/python3.8/http/client.py", line 1011, in _send_output
    self.send(msg)
  File "/home/nsemmler/.pyenv/versions/3.8.15/lib/python3.8/http/client.py", line 951, in send
    self.connect()
  File "/media/psf/Home/vm_files/notebooks/venv/lib/python3.8/site-packages/snowflake/connector/vendored/urllib3/connection.py", line 205, in connect
    conn = self._new_conn()
  File "/media/psf/Home/vm_files/notebooks/venv/lib/python3.8/site-packages/snowflake/connector/vendored/urllib3/connection.py", line 179, in _new_conn
    raise ConnectTimeoutError(
snowflake.connector.vendored.urllib3.exceptions.ConnectTimeoutError: (<snowflake.connector.vendored.urllib3.connection.HTTPConnection object at 0xffff8cedb940>, 'Connection to fubar.snowflakecomputing.com timed out. (connect timeout=5)')

During handling of the above exception, another exception occurred:

Traceback (most recent call last):
  File "/media/psf/Home/vm_files/notebooks/venv/lib/python3.8/site-packages/snowflake/connector/vendored/requests/adapters.py", line 489, in send
    resp = conn.urlopen(
  File "/media/psf/Home/vm_files/notebooks/venv/lib/python3.8/site-packages/snowflake/connector/vendored/urllib3/connectionpool.py", line 815, in urlopen
    return self.urlopen(
  File "/media/psf/Home/vm_files/notebooks/venv/lib/python3.8/site-packages/snowflake/connector/vendored/urllib3/connectionpool.py", line 787, in urlopen
    retries = retries.increment(
  File "/media/psf/Home/vm_files/notebooks/venv/lib/python3.8/site-packages/snowflake/connector/vendored/urllib3/util/retry.py", line 592, in increment
    raise MaxRetryError(_pool, url, error or ResponseError(cause))
snowflake.connector.vendored.urllib3.exceptions.MaxRetryError: HTTPConnectionPool(host='fubar.snowflakecomputing.com', port=8084): Max retries exceeded with url: /session/v1/login-request?request_id=632a685c-8715-43a9-afed-a807df3cb26b&request_guid=aab79e81-8230-4549-837e-ce902d39e010 (Caused by ConnectTimeoutError(<snowflake.connector.vendored.urllib3.connection.HTTPConnection object at 0xffff8cedb940>, 'Connection to fubar.snowflakecomputing.com timed out. (connect timeout=5)'))

During handling of the above exception, another exception occurred:

Traceback (most recent call last):
  File "/media/psf/Home/vm_files/notebooks/venv/lib/python3.8/site-packages/snowflake/connector/network.py", line 1018, in _request_exec
    raw_ret = session.request(
  File "/media/psf/Home/vm_files/notebooks/venv/lib/python3.8/site-packages/snowflake/connector/vendored/requests/sessions.py", line 587, in request
    resp = self.send(prep, **send_kwargs)
snowflake.connector.vendored.requests.exceptions.ConnectTimeout: HTTPConnectionPool(host='fubar.snowflakecomputing.com', port=8084): Max retries exceeded with url: /session/v1/login-request?request_id=632a685c-8715-43a9-afed-a807df3cb26b&request_guid=aab79e81-8230-4549-837e-ce902d39e010 (Caused by ConnectTimeoutError(<snowflake.connector.vendored.urllib3.connection.HTTPConnection object at 0xffff8cedb940>, 'Connection to fubar.snowflakecomputing.com timed out. (connect timeout=5)'))

During handling of the above exception, another exception occurred:

Traceback (most recent call last):
  File "/media/psf/Home/vm_files/notebooks/venv/lib/python3.8/site-packages/snowflake/connector/connection.py", line 1071, in __authenticate
    auth.authenticate(
  File "/media/psf/Home/vm_files/notebooks/venv/lib/python3.8/site-packages/snowflake/connector/auth.py", line 257, in authenticate
    ret = self._rest._post_request(
  File "/media/psf/Home/vm_files/notebooks/venv/lib/python3.8/site-packages/snowflake/connector/network.py", line 704, in _post_request
    ret = self.fetch(
  File "/media/psf/Home/vm_files/notebooks/venv/lib/python3.8/site-packages/snowflake/connector/network.py", line 794, in fetch
    ret = self._request_exec_wrapper(
  File "/media/psf/Home/vm_files/notebooks/venv/lib/python3.8/site-packages/snowflake/connector/network.py", line 917, in _request_exec_wrapper
    raise e
  File "/media/psf/Home/vm_files/notebooks/venv/lib/python3.8/site-packages/snowflake/connector/network.py", line 837, in _request_exec_wrapper
    return_object = self._request_exec(
  File "/media/psf/Home/vm_files/notebooks/venv/lib/python3.8/site-packages/snowflake/connector/network.py", line 1095, in _request_exec
    raise OperationalError(
snowflake.connector.errors.OperationalError: 251011: 251011: ConnectionTimeout occurred. Will be handled by authenticator

During handling of the above exception, another exception occurred:

Traceback (most recent call last):
  File "/media/psf/Home/vm_files/notebooks/venv/lib/python3.8/site-packages/snowflake/connector/vendored/urllib3/connection.py", line 174, in _new_conn
    conn = connection.create_connection(
  File "/media/psf/Home/vm_files/notebooks/venv/lib/python3.8/site-packages/snowflake/connector/vendored/urllib3/util/connection.py", line 95, in create_connection
    raise err
  File "/media/psf/Home/vm_files/notebooks/venv/lib/python3.8/site-packages/snowflake/connector/vendored/urllib3/util/connection.py", line 85, in create_connection
    sock.connect(sa)
socket.timeout: timed out

During handling of the above exception, another exception occurred:

Traceback (most recent call last):
  File "/media/psf/Home/vm_files/notebooks/venv/lib/python3.8/site-packages/snowflake/connector/vendored/urllib3/connectionpool.py", line 703, in urlopen
    httplib_response = self._make_request(
  File "/media/psf/Home/vm_files/notebooks/venv/lib/python3.8/site-packages/snowflake/connector/vendored/urllib3/connectionpool.py", line 398, in _make_request
    conn.request(method, url, **httplib_request_kw)
  File "/media/psf/Home/vm_files/notebooks/venv/lib/python3.8/site-packages/snowflake/connector/vendored/urllib3/connection.py", line 239, in request    super(HTTPConnection, self).request(method, url, body=body, headers=headers)
  File "/home/nsemmler/.pyenv/versions/3.8.15/lib/python3.8/http/client.py", line 1256, in request
    self._send_request(method, url, body, headers, encode_chunked)
  File "/home/nsemmler/.pyenv/versions/3.8.15/lib/python3.8/http/client.py", line 1302, in _send_request
11:47:48.582678 IP sdp-devvm-nsemmler.shared.41460 > ec2-34-214-80-55.us-west-2.compute.amazonaws.com.8084: Flags [S], seq 353492639, win 64240, options [mss 1460,sackOK,TS val 2355915590 ecr 0,nop,wscale 7], length 0
11:47:50.458138 IP sdp-devvm-nsemmler.shared.50412 > ec2-35-155-250-235.us-west-2.compute.amazonaws.com.8084: Flags [S], seq 2934908518, win 64240, options [mss 1460,sackOK,TS val 2919201390 ecr 0,nop,wscale 7], length 0
11:47:51.463397 IP sdp-devvm-nsemmler.shared.50412 > ec2-35-155-250-235.us-west-2.compute.amazonaws.com.8084: Flags [S], seq 2934908518, win 64240, options [mss 1460,sackOK,TS val 2919202395 ecr 0,nop,wscale 7], length 0
11:47:53.543283 IP sdp-devvm-nsemmler.shared.50412 > ec2-35-155-250-235.us-west-2.compute.amazonaws.com.8084: Flags [S], seq 2934908518, win 64240, options [mss 1460,sackOK,TS val 2919204475 ecr 0,nop,wscale 7], length 0
    conn = self._new_conn()
  File "/media/psf/Home/vm_files/notebooks/venv/lib/python3.8/site-packages/snowflake/connector/vendored/urllib3/connection.py", line 179, in _new_conn
    raise ConnectTimeoutError(
snowflake.connector.vendored.urllib3.exceptions.ConnectTimeoutError: (<snowflake.connector.vendored.urllib3.connection.HTTPConnection object at 0xffff8cec5b80>, 'Connection to fubar.snowflakecomputing.com timed out. (connect timeout=5)')

During handling of the above exception, another exception occurred:

Traceback (most recent call last):
  File "/media/psf/Home/vm_files/notebooks/venv/lib/python3.8/site-packages/snowflake/connector/vendored/requests/adapters.py", line 489, in send
    resp = conn.urlopen(
  File "/media/psf/Home/vm_files/notebooks/venv/lib/python3.8/site-packages/snowflake/connector/vendored/urllib3/connectionpool.py", line 815, in urlopen
    return self.urlopen(
  File "/media/psf/Home/vm_files/notebooks/venv/lib/python3.8/site-packages/snowflake/connector/vendored/urllib3/connectionpool.py", line 787, in urlopen
    retries = retries.increment(
  File "/media/psf/Home/vm_files/notebooks/venv/lib/python3.8/site-packages/snowflake/connector/vendored/urllib3/util/retry.py", line 592, in increment
    raise MaxRetryError(_pool, url, error or ResponseError(cause))
snowflake.connector.vendored.urllib3.exceptions.MaxRetryError: HTTPConnectionPool(host='fubar.snowflakecomputing.com', port=8084): Max retries exceeded with url: /session/v1/login-request?request_id=821bfec4-9ecb-4cfa-b304-8313efc3c1de&request_guid=f796497d-e8ad-46ac-821a-7df932ef3431 (Caused by ConnectTimeoutError(<snowflake.connector.vendored.urllib3.connection.HTTPConnection object at 0xffff8cec5b80>, 'Connection to fubar.snowflakecomputing.com timed out. (connect timeout=5)'))

During handling of the above exception, another exception occurred:

Traceback (most recent call last):
  File "/media/psf/Home/vm_files/notebooks/venv/lib/python3.8/site-packages/snowflake/connector/network.py", line 1018, in _request_exec
    raw_ret = session.request(
  File "/media/psf/Home/vm_files/notebooks/venv/lib/python3.8/site-packages/snowflake/connector/vendored/requests/sessions.py", line 587, in request
    resp = self.send(prep, **send_kwargs)
  File "/media/psf/Home/vm_files/notebooks/venv/lib/python3.8/site-packages/snowflake/connector/vendored/requests/sessions.py", line 701, in send
    r = adapter.send(request, **kwargs)
  File "/media/psf/Home/vm_files/notebooks/venv/lib/python3.8/site-packages/snowflake/connector/vendored/requests/adapters.py", line 553, in send
    raise ConnectTimeout(e, request=request)
snowflake.connector.vendored.requests.exceptions.ConnectTimeout: HTTPConnectionPool(host='fubar.snowflakecomputing.com', port=8084): Max retries exceeded with url: /session/v1/login-request?request_id=821bfec4-9ecb-4cfa-b304-8313efc3c1de&request_guid=f796497d-e8ad-46ac-821a-7df932ef3431 (Caused by ConnectTimeoutError(<snowflake.connector.vendored.urllib3.connection.HTTPConnection object at 0xffff8cec5b80>, 'Connection to fubar.snowflakecomputing.com timed out. (connect timeout=5)'))
2022-11-09 11:48:00,493 - MainThread network.py:1152 - _use_requests_session() - DEBUG - Session status for SessionPool 'fubar.snowflakecomputing.com', SessionPool 0/1 active sessions
2022-11-09 11:48:00,493 - MainThread connection.py:1117 - __authenticate() - DEBUG - Continuing authenticator specific timeout handling
2022-11-09 11:48:00,493 - MainThread auth_by_plugin.py:114 - handle_timeout() - DEBUG - Default timeout handler invoked for authenticator
FAILED
 role=None, request_id=015b4f9d-2607-45f6-b190-c5800e48e5eb
2022-11-09 11:48:35,982 - MainThread auth.py:236 - authenticate() - DEBUG - body['data']: {'CLIENT_APP_ID': 'PythonConnector', 'CLIENT_APP_VERSION': '2.8.0', 'SVN_REVISION': None, 'ACCOUNT_NAME': 'myaccount', 'LOGIN_NAME': 'user', 'CLIENT_ENVIRONMENT': {'APPLICATION': 'PythonConnector', 'OS': 'Linux', 'OS_VERSION': 'Linux-5.16.13-generic-aarch64-with-glibc2.17', 'PYTHON_VERSION': '3.8.15', 'PYTHON_RUNTIME': 'CPython', 'PYTHON_COMPILER': 'GCC 4.8.5 20150623 (Red Hat 4.8.5-44)', 'OCSP_MODE': 'FAIL_OPEN', 'TRACING': 10, 'LOGIN_TIMEOUT': 5, 'NETWORK_TIMEOUT': None}, 'SESSION_PARAMETERS': {'CLIENT_PREFETCH_THREADS': 4}}
2022-11-09 11:48:35,982 - MainThread auth.py:254 - authenticate() - DEBUG - Timeout set to 5
2022-11-09 11:48:35,983 - MainThread retry.py:351 - from_int() - DEBUG - Converted retries value: 1 -> Retry(total=1, connect=None, read=None, redirect=None, status=None)
2022-11-09 11:48:35,983 - MainThread retry.py:351 - from_int() - DEBUG - Converted retries value: 1 -> Retry(total=1, connect=None, read=None, redirect=None, status=None)
2022-11-09 11:48:35,983 - MainThread network.py:1147 - _use_requests_session() - DEBUG - Session status for SessionPool 'fubar.snowflakecomputing.com', SessionPool 1/1 active sessions
2022-11-09 11:48:35,983 - MainThread network.py:827 - _request_exec_wrapper() - DEBUG - remaining request timeout: 5, retry cnt: 1
2022-11-09 11:48:35,984 - MainThread network.py:808 - add_request_guid() - DEBUG - Request guid: 13bcb7da-1f34-4243-a0d8-a7a153396fb3
2022-11-09 11:48:35,984 - MainThread network.py:1006 - _request_exec() - DEBUG - socket timeout: 5
2022-11-09 11:48:35,989 - MainThread connectionpool.py:1003 - _new_conn() - DEBUG - Starting new HTTPS connection (1): fubar.snowflakecomputing.com:8084
2022-11-09 11:48:51,030 - MainThread retry.py:594 - increment() - DEBUG - Incremented Retry for (url='/session/v1/login-request?request_id=015b4f9d-2607-45f6-b190-c5800e48e5eb&request_guid=13bcb7da-1f34-4243-a0d8-a7a153396fb3'): Retry(total=0, connect=None, read=None, redirect=None, status=None)
2022-11-09 11:48:51,030 - MainThread connectionpool.py:812 - urlopen() - WARNING - Retrying (Retry(total=0, connect=None, read=None, redirect=None, status=None)) after connection broken by 'ConnectTimeoutError(<snowflake.connector.vendored.urllib3.connection.HTTPSConnection object at 0xffff8cdb8190>, 'Connection to fubar.snowflakecomputing.com timed out. (connect timeout=5)')': /session/v1/login-request?request_id=015b4f9d-2607-45f6-b190-c5800e48e5eb&request_guid=13bcb7da-1f34-4243-a0d8-a7a153396fb3
2022-11-09 11:48:51,031 - MainThread connectionpool.py:1003 - _new_conn() - DEBUG - Starting new HTTPS connection (2): fubar.snowflakecomputing.com:8084
2022-11-09 11:49:06,055 - MainThread network.py:1090 - _request_exec() - DEBUG - Hit a timeout error while logging in. Will be handled by authenticator. Ignore the following. Error stack: HTTPSConnectionPool(host='fubar.snowflakecomputing.com', port=8084): Max retries exceeded with url: /session/v1/login-request?request_id=015b4f9d-2607-45f6-b190-c5800e48e5eb&request_guid=13bcb7da-1f34-4243-a0d8-a7a153396fb3 (Caused by ConnectTimeoutError(<snowflake.connector.vendored.urllib3.connection.HTTPSConnection object at 0xffff8cdb8280>, 'Connection to fubar.snowflakecomputing.com timed out. (connect timeout=5)'))
Traceback (most recent call last):
  File "/media/psf/Home/vm_files/notebooks/venv/lib/python3.8/site-packages/snowflake/connector/vendored/urllib3/connection.py", line 174, in _new_conn
    conn = connection.create_connection(
  File "/media/psf/Home/vm_files/notebooks/venv/lib/python3.8/site-packages/snowflake/connector/vendored/urllib3/util/connection.py", line 95, in create_connection
    raise err
  File "/media/psf/Home/vm_files/notebooks/venv/lib/python3.8/site-packages/snowflake/connector/vendored/urllib3/util/connection.py", line 85, in create_connection
    sock.connect(sa)
socket.timeout: timed out

During handling of the above exception, another exception occurred:

Traceback (most recent call last):
  File "/media/psf/Home/vm_files/notebooks/venv/lib/python3.8/site-packages/snowflake/connector/vendored/urllib3/connectionpool.py", line 703, in urlopen
    httplib_response = self._make_request(
  File "/media/psf/Home/vm_files/notebooks/venv/lib/python3.8/site-packages/snowflake/connector/vendored/urllib3/connectionpool.py", line 386, in _make_request
    self._validate_conn(conn)
  File "/media/psf/Home/vm_files/notebooks/venv/lib/python3.8/site-packages/snowflake/connector/vendored/urllib3/connectionpool.py", line 1042, in _validate_conn
    conn.connect()
  File "/media/psf/Home/vm_files/notebooks/venv/lib/python3.8/site-packages/snowflake/connector/vendored/urllib3/connection.py", line 358, in connect    self.sock = conn = self._new_conn()
  File "/media/psf/Home/vm_files/notebooks/venv/lib/python3.8/site-packages/snowflake/connector/vendored/urllib3/connection.py", line 179, in _new_conn
    raise ConnectTimeoutError(
snowflake.connector.vendored.urllib3.exceptions.ConnectTimeoutError: (<snowflake.connector.vendored.urllib3.connection.HTTPSConnection object at 0xffff8cdb8280>, 'Connection to fubar.snowflakecomputing.com timed out. (connect timeout=5)')

During handling of the above exception, another exception occurred:

Traceback (most recent call last):
  File "/media/psf/Home/vm_files/notebooks/venv/lib/python3.8/site-packages/snowflake/connector/vendored/requests/adapters.py", line 489, in send
    resp = conn.urlopen(
  File "/media/psf/Home/vm_files/notebooks/venv/lib/python3.8/site-packages/snowflake/connector/vendored/urllib3/connectionpool.py", line 815, in urlopen
    return self.urlopen(
  File "/media/psf/Home/vm_files/notebooks/venv/lib/python3.8/site-packages/snowflake/connector/vendored/urllib3/connectionpool.py", line 787, in urlopen
    retries = retries.increment(
  File "/media/psf/Home/vm_files/notebooks/venv/lib/python3.8/site-packages/snowflake/connector/vendored/urllib3/util/retry.py", line 592, in increment
    raise MaxRetryError(_pool, url, error or ResponseError(cause))
snowflake.connector.vendored.urllib3.exceptions.MaxRetryError: HTTPSConnectionPool(host='fubar.snowflakecomputing.com', port=8084): Max retries exceeded with url: /session/v1/login-request?request_id=015b4f9d-2607-45f6-b190-c5800e48e5eb&request_guid=13bcb7da-1f34-4243-a0d8-a7a153396fb3 (Caused by ConnectTimeoutError(<snowflake.connector.vendored.urllib3.connection.HTTPSConnection object at 0xffff8cdb8280>, 'Connection to fubar.snowflakecomputing.com timed out. (connect timeout=5)'))

During handling of the above exception, another exception occurred:

Traceback (most recent call last):
  File "/media/psf/Home/vm_files/notebooks/venv/lib/python3.8/site-packages/snowflake/connector/network.py", line 1018, in _request_exec
    raw_ret = session.request(
  File "/media/psf/Home/vm_files/notebooks/venv/lib/python3.8/site-packages/snowflake/connector/vendored/requests/sessions.py", line 587, in request
    resp = self.send(prep, **send_kwargs)
  File "/media/psf/Home/vm_files/notebooks/venv/lib/python3.8/site-packages/snowflake/connector/vendored/requests/sessions.py", line 701, in send
    r = adapter.send(request, **kwargs)
  File "/media/psf/Home/vm_files/notebooks/venv/lib/python3.8/site-packages/snowflake/connector/vendored/requests/adapters.py", line 553, in send
    raise ConnectTimeout(e, request=request)
snowflake.connector.vendored.requests.exceptions.ConnectTimeout: HTTPSConnectionPool(host='fubar.snowflakecomputing.com', port=8084): Max retries exceeded with url: /session/v1/login-request?request_id=015b4f9d-2607-45f6-b190-c5800e48e5eb&request_guid=13bcb7da-1f34-4243-a0d8-a7a153396fb3 (Caused by ConnectTimeoutError(<snowflake.connector.vendored.urllib3.connection.HTTPSConnection object at 0xffff8cdb8280>, 'Connection to fubar.snowflakecomputing.com timed out. (connect timeout=5)'))
2022-11-09 11:49:06,071 - MainThread network.py:1152 - _use_requests_session() - DEBUG - Session status for SessionPool 'fubar.snowflakecomputing.com', SessionPool 0/1 active sessions
2022-11-09 11:49:06,077 - MainThread connection.py:1086 - __authenticate() - DEBUG - Operational Error raised at authenticationfor authenticator: AuthByDefault
2022-11-09 11:49:06,078 - MainThread auth_by_plugin.py:114 - handle_timeout() - DEBUG - Default timeout handler invoked for authenticator
2022-11-09 11:49:06,078 - MainThread auth_by_plugin.py:123 - handle_timeout() - DEBUG - Hit connection timeout, attempt number 0. Will retry in a bit...
2022-11-09 11:49:06,078 - MainThread auth_by_plugin.py:56 - next_sleep_duration() - DEBUG - Sleeping for 2 seconds
2022-11-09 11:49:08,080 - MainThread auth.py:170 - authenticate() - DEBUG - authenticate
2022-11-09 11:49:08,081 - MainThread auth.py:200 - authenticate() - DEBUG - assertion content: *********
2022-11-09 11:49:08,081 - MainThread auth.py:203 - authenticate() - DEBUG - account=myaccount, user=user, database=None, schema=None, warehouse=None, role=None, request_id=e4bff12a-574d-4b16-8f64-d19c002c5be8
2022-11-09 11:49:08,081 - MainThread auth.py:236 - authenticate() - DEBUG - body['data']: {'CLIENT_APP_ID': 'PythonConnector', 'CLIENT_APP_VERSION': '2.8.0', 'SVN_REVISION': None, 'ACCOUNT_NAME': 'myaccount', 'LOGIN_NAME': 'user', 'CLIENT_ENVIRONMENT': {'APPLICATION': 'PythonConnector', 'OS': 'Linux', 'OS_VERSION': 'Linux-5.16.13-generic-aarch64-with-glibc2.17', 'PYTHON_VERSION': '3.8.15', 'PYTHON_RUNTIME': 'CPython', 'PYTHON_COMPILER': 'GCC 4.8.5 20150623 (Red Hat 4.8.5-44)', 'OCSP_MODE': 'FAIL_OPEN', 'TRACING': 10, 'LOGIN_TIMEOUT': 5, 'NETWORK_TIMEOUT': None}, 'SESSION_PARAMETERS': {'CLIENT_PREFETCH_THREADS': 4}}
2022-11-09 11:49:08,082 - MainThread auth.py:254 - authenticate() - DEBUG - Timeout set to 5
2022-11-09 11:49:08,082 - MainThread network.py:1147 - _use_requests_session() - DEBUG - Session status for SessionPool 'fubar.snowflakecomputing.com', SessionPool 1/1 active sessions
2022-11-09 11:49:08,083 - MainThread network.py:827 - _request_exec_wrapper() - DEBUG - remaining request timeout: 5, retry cnt: 1
2022-11-09 11:49:08,083 - MainThread network.py:808 - add_request_guid() - DEBUG - Request guid: 699c5f7d-8bdf-452a-ae8e-c819e8c9de16
2022-11-09 11:49:08,083 - MainThread network.py:1006 - _request_exec() - DEBUG - socket timeout: 5
2022-11-09 11:49:08,096 - MainThread connectionpool.py:1003 - _new_conn() - DEBUG - Starting new HTTPS connection (3): fubar.snowflakecomputing.com:8084
2022-11-09 11:49:23,133 - MainThread retry.py:594 - increment() - DEBUG - Incremented Retry for (url='/session/v1/login-request?request_id=e4bff12a-574d-4b16-8f64-d19c002c5be8&request_guid=699c5f7d-8bdf-452a-ae8e-c819e8c9de16'): Retry(total=0, connect=None, read=None, redirect=None, status=None)
2022-11-09 11:49:23,134 - MainThread connectionpool.py:812 - urlopen() - WARNING - Retrying (Retry(total=0, connect=None, read=None, redirect=None, status=None)) after connection broken by 'ConnectTimeoutError(<snowflake.connector.vendored.urllib3.connection.HTTPSConnection object at 0xffff8cdb8220>, 'Connection to fubar.snowflakecomputing.com timed out. (connect timeout=5)')': /session/v1/login-request?request_id=e4bff12a-574d-4b16-8f64-d19c002c5be8&request_guid=699c5f7d-8bdf-452a-ae8e-c819e8c9de16
2022-11-09 11:49:23,135 - MainThread connectionpool.py:1003 - _new_conn() - DEBUG - Starting new HTTPS connection (4): fubar.snowflakecomputing.com:8084
2022-11-09 11:49:38,179 - MainThread network.py:1090 - _request_exec() - DEBUG - Hit a timeout error while logging in. Will be handled by authenticator. Ignore the following. Error stack: HTTPSConnectionPool(host='fubar.snowflakecomputing.com', port=8084): Max retries exceeded with url: /session/v1/login-request?request_id=e4bff12a-574d-4b16-8f64-d19c002c5be8&request_guid=699c5f7d-8bdf-452a-ae8e-c819e8c9de16 (Caused by ConnectTimeoutError(<snowflake.connector.vendored.urllib3.connection.HTTPSConnection object at 0xffff8cd33e20>, 'Connection to fubar.snowflakecomputing.com timed out. (connect timeout=5)'))
Traceback (most recent call last):
  File "/media/psf/Home/vm_files/notebooks/venv/lib/python3.8/site-packages/snowflake/connector/vendored/urllib3/connection.py", line 174, in _new_conn
    conn = connection.create_connection(
  File "/media/psf/Home/vm_files/notebooks/venv/lib/python3.8/site-packages/snowflake/connector/vendored/urllib3/util/connection.py", line 95, in create_connection
    raise err
  File "/media/psf/Home/vm_files/notebooks/venv/lib/python3.8/site-packages/snowflake/connector/vendored/urllib3/util/connection.py", line 85, in create_connection
    sock.connect(sa)
socket.timeout: timed out

During handling of the above exception, another exception occurred:

Traceback (most recent call last):
  File "/media/psf/Home/vm_files/notebooks/venv/lib/python3.8/site-packages/snowflake/connector/vendored/urllib3/connectionpool.py", line 703, in urlopen
    httplib_response = self._make_request(
  File "/media/psf/Home/vm_files/notebooks/venv/lib/python3.8/site-packages/snowflake/connector/vendored/urllib3/connectionpool.py", line 386, in _make_request
    self._validate_conn(conn)
  File "/media/psf/Home/vm_files/notebooks/venv/lib/python3.8/site-packages/snowflake/connector/vendored/urllib3/connectionpool.py", line 1042, in _validate_conn
    conn.connect()
  File "/media/psf/Home/vm_files/notebooks/venv/lib/python3.8/site-packages/snowflake/connector/vendored/urllib3/connection.py", line 358, in connect
    self.sock = conn = self._new_conn()
  File "/media/psf/Home/vm_files/notebooks/venv/lib/python3.8/site-packages/snowflake/connector/vendored/urllib3/connection.py", line 179, in _new_conn
    raise ConnectTimeoutError(
snowflake.connector.vendored.urllib3.exceptions.ConnectTimeoutError: (<snowflake.connector.vendored.urllib3.connection.HTTPSConnection object at 0xffff8cdb8280>, 'Connection to fubar.snowflakecomputing.com timed out. (connect timeout=5)')

During handling of the above exception, another exception occurred:

Traceback (most recent call last):
  File "/media/psf/Home/vm_files/notebooks/venv/lib/python3.8/site-packages/snowflake/connector/vendored/requests/adapters.py", line 489, in send
    resp = conn.urlopen(
  File "/media/psf/Home/vm_files/notebooks/venv/lib/python3.8/site-packages/snowflake/connector/vendored/requests/sessions.py", line 587, in request
    resp = self.send(prep, **send_kwargs)
  File "/media/psf/Home/vm_files/notebooks/venv/lib/python3.8/site-packages/snowflake/connector/vendored/requests/sessions.py", line 701, in send
    r = adapter.send(request, **kwargs)
  File "/media/psf/Home/vm_files/notebooks/venv/lib/python3.8/site-packages/snowflake/connector/vendored/requests/adapters.py", line 553, in send
    raise ConnectTimeout(e, request=request)
snowflake.connector.vendored.requests.exceptions.ConnectTimeout: HTTPSConnectionPool(host='fubar.snowflakecomputing.com', port=8084): Max retries exceeded with url: /session/v1/login-request?request_id=015b4f9d-2607-45f6-b190-c5800e48e5eb&request_guid=13bcb7da-1f34-4243-a0d8-a7a153396fb3 (Caused by ConnectTimeoutError(<snowflake.connector.vendored.urllib3.connection.HTTPSConnection object at 0xffff8cdb8280>, 'Connection to fubar.snowflakecomputing.com timed out. (connect timeout=5)'))

During handling of the above exception, another exception occurred:

Traceback (most recent call last):
  File "/media/psf/Home/vm_files/notebooks/venv/lib/python3.8/site-packages/snowflake/connector/connection.py", line 1071, in __authenticate
    auth.authenticate(
  File "/media/psf/Home/vm_files/notebooks/venv/lib/python3.8/site-packages/snowflake/connector/auth.py", line 257, in authenticate
    ret = self._rest._post_request(
  File "/media/psf/Home/vm_files/notebooks/venv/lib/python3.8/site-packages/snowflake/connector/network.py", line 704, in _post_request
    ret = self.fetch(
  File "/media/psf/Home/vm_files/notebooks/venv/lib/python3.8/site-packages/snowflake/connector/network.py", line 794, in fetch
    ret = self._request_exec_wrapper(
  File "/media/psf/Home/vm_files/notebooks/venv/lib/python3.8/site-packages/snowflake/connector/network.py", line 917, in _request_exec_wrapper
    raise e
  File "/media/psf/Home/vm_files/notebooks/venv/lib/python3.8/site-packages/snowflake/connector/network.py", line 837, in _request_exec_wrapper
    return_object = self._request_exec(
  File "/media/psf/Home/vm_files/notebooks/venv/lib/python3.8/site-packages/snowflake/connector/network.py", line 1095, in _request_exec
    raise OperationalError(
snowflake.connector.errors.OperationalError: 251011: 251011: ConnectionTimeout occurred. Will be handled by authenticator

During handling of the above exception, another exception occurred:

Traceback (most recent call last):
  File "/media/psf/Home/vm_files/notebooks/venv/lib/python3.8/site-packages/snowflake/connector/vendored/urllib3/connection.py", line 174, in _new_conn
    conn = connection.create_connection(
  File "/media/psf/Home/vm_files/notebooks/venv/lib/python3.8/site-packages/snowflake/connector/vendored/urllib3/util/connection.py", line 95, in create_connection
    raise err
  File "/media/psf/Home/vm_files/notebooks/venv/lib/python3.8/site-packages/snowflake/connector/vendored/urllib3/util/connection.py", line 85, in create_connection
    sock.connect(sa)
socket.timeout: timed out

During handling of the above exception, another exception occurred:

Traceback (most recent call last):
  File "/media/psf/Home/vm_files/notebooks/venv/lib/python3.8/site-packages/snowflake/connector/vendored/urllib3/connectionpool.py", line 703, in urlopen
    httplib_response = self._make_request(
  File "/media/psf/Home/vm_files/notebooks/venv/lib/python3.8/site-packages/snowflake/connector/vendored/urllib3/connectionpool.py", line 386, in _make_request
    self._validate_conn(conn)
  File "/media/psf/Home/vm_files/notebooks/venv/lib/python3.8/site-packages/snowflake/connector/vendored/urllib3/connectionpool.py", line 1042, in _validate_conn
    conn.connect()
  File "/media/psf/Home/vm_files/notebooks/venv/lib/python3.8/site-packages/snowflake/connector/vendored/urllib3/connection.py", line 358, in connect
    self.sock = conn = self._new_conn()
  File "/media/psf/Home/vm_files/notebooks/venv/lib/python3.8/site-packages/snowflake/connector/vendored/urllib3/connection.py", line 179, in _new_conn
    raise ConnectTimeoutError(
snowflake.connector.vendored.urllib3.exceptions.ConnectTimeoutError: (<snowflake.connector.vendored.urllib3.connection.HTTPSConnection object at 0xffff8cd33e20>, 'Connection to fubar.snowflakecomputing.com timed out. (connect timeout=5)')

During handling of the above exception, another exception occurred:

Traceback (most recent call last):
  File "/media/psf/Home/vm_files/notebooks/venv/lib/python3.8/site-packages/snowflake/connector/vendored/requests/adapters.py", line 489, in send
    resp = conn.urlopen(
  File "/media/psf/Home/vm_files/notebooks/venv/lib/python3.8/site-packages/snowflake/connector/vendored/urllib3/connectionpool.py", line 815, in urlopen
    return self.urlopen(
  File "/media/psf/Home/vm_files/notebooks/venv/lib/python3.8/site-packages/snowflake/connector/vendored/urllib3/connectionpool.py", line 787, in urlopen
    retries = retries.increment(
  File "/media/psf/Home/vm_files/notebooks/venv/lib/python3.8/site-packages/snowflake/connector/vendored/urllib3/util/retry.py", line 592, in increment
    raise MaxRetryError(_pool, url, error or ResponseError(cause))
snowflake.connector.vendored.urllib3.exceptions.MaxRetryError: HTTPSConnectionPool(host='fubar.snowflakecomputing.com', port=8084): Max retries exceeded with url: /session/v1/login-request?request_id=e4bff12a-574d-4b16-8f64-d19c002c5be8&request_guid=699c5f7d-8bdf-452a-ae8e-c819e8c9de16 (Caused by ConnectTimeoutError(<snowflake.connector.vendored.urllib3.connection.HTTPSConnection object at 0xffff8cd33e20>, 'Connection to fubar.snowflakecomputing.com timed out. (connect timeout=5)'))

During handling of the above exception, another exception occurred:

Traceback (most recent call last):
  File "/media/psf/Home/vm_files/notebooks/venv/lib/python3.8/site-packages/snowflake/connector/network.py", line 1018, in _request_exec
    raw_ret = session.request(
  File "/media/psf/Home/vm_files/notebooks/venv/lib/python3.8/site-packages/snowflake/connector/vendored/requests/sessions.py", line 587, in request
    resp = self.send(prep, **send_kwargs)
  File "/media/psf/Home/vm_files/notebooks/venv/lib/python3.8/site-packages/snowflake/connector/vendored/requests/sessions.py", line 701, in send
    r = adapter.send(request, **kwargs)
  File "/media/psf/Home/vm_files/notebooks/venv/lib/python3.8/site-packages/snowflake/connector/vendored/requests/adapters.py", line 553, in send
    raise ConnectTimeout(e, request=request)
snowflake.connector.vendored.requests.exceptions.ConnectTimeout: HTTPSConnectionPool(host='fubar.snowflakecomputing.com', port=8084): Max retries exceeded with url: /session/v1/login-request?request_id=e4bff12a-574d-4b16-8f64-d19c002c5be8&request_guid=699c5f7d-8bdf-452a-ae8e-c819e8c9de16 (Caused by ConnectTimeoutError(<snowflake.connector.vendored.urllib3.connection.HTTPSConnection object at 0xffff8cd33e20>, 'Connection to fubar.snowflakecomputing.com timed out. (connect timeout=5)'))
2022-11-09 11:49:38,191 - MainThread network.py:1152 - _use_requests_session() - DEBUG - Session status for SessionPool 'fubar.snowflakecomputing.com', SessionPool 0/1 active sessions
2022-11-09 11:49:38,191 - MainThread connection.py:1117 - __authenticate() - DEBUG - Continuing authenticator specific timeout handling
2022-11-09 11:49:38,191 - MainThread auth_by_plugin.py:114 - handle_timeout() - DEBUG - Default timeout handler invoked for authenticator
```

**Comment by sfc-gh-aling** [comment]
hey @sfc-gh-nsemmler , thanks for collecting the logs, and providing the feedback.

I definitely agree upon that the timeout and retry mechanism needs more clarity -- specifically in your case, I see multiple ways in interpret the timeout as per try timeout or total timeout which could lead to confusion.

I need to think over this to see if we could introduce a fine-grained timeout/retry config to give more control while avoid confusion.

**Comment by adityakumar1990** [comment]
Hi , can you help me to figure out the changes for the https://github.com/snowflakedb/snowflake-connector-python/issues/1324 issue

**Comment by dhuang** [comment]
+1 we would appreciate more fine-grained timeout/retry config!

**Comment by mbwmbw1337** [comment]
Seeing a similar issue in #1342

**Comment by marcin-molak-discovery** [comment]
+1 we found same issue for snowflake-connector usage by Airflow. Long procedure create ReadTimeout exception

**Comment by sfc-gh-dszmolka** [comment]
going to mark this as closed for now as it is hopefully fixed with [3.4.0](https://github.com/snowflakedb/snowflake-connector-python/releases/tag/v3.4.0)
> * Added the backoff_policy argument to snowflake.connector.connect allowing for configurable backoff policy between retries of failed requests. See available implementations in the backoff_policies module.
> * Added the socket_timeout argument to snowflake.connector.connect specifying socket read and connect timeout.
> * Fixed login_timeout and network_timeout behaviour. Retries of login and network requests are now properly halted after these timeouts expire.

but please do comment if the issue still persist even with setting the exposed timeout values.
